Tip Name,Detailed Tip Text,Tip Image
Combat Guide and Tips,"Environmental Advantage: : Hiding behind obstacles can help you sneak your way closer to unsuspecting enemies for a stealth kill. Take note of the environment before diving into a fight, this way you can avoid taking damage while slowly reducing the enemy numbers or have a place to hide if you ever need to heal yourself., Aim for the head!: : Shooting a target in the head will conserve ammo, and allow you to dispose of threats quicker. Upgrading a weapons stability will make this much easier to nail consistently!, Running Away: : While stealth is usually the best option, in certain situations, you may want to just run away entirely. This is especially true when you are faced with a large group of runners and clickers together. Trying to fight the runners can make it easy for a clicker to one-shot you, so if possible, try and get past them all.How to Run (Sprint), Throwables and Stunning Enemies: : Stunning enemies by throwing a glass bottle or a brick is an effective way to get close to an enemy. Be sure to use them on unsuspecting or approaching enemies as much as you need to., Listen Mode to Locate Enemies: : Using Listen Mode can help you pinpoint the exact location of a nearby enemy and which direction they are facing. Use this to your advantage to take out enemies easier and more effectively. Keep in mind that Listen Mode will also allow you to see the Scent Trail that you left, which can get you into trouble if there is an enemy dog.How to Use Listen Mode, Prone In Tall Grass: : Fighting outside in an open area can make you vulnerable to enemy attacks, especially if you are fighting against a large group. You can hide in the tall grass to prevent the enemies from spotting you this can help you close the gap between enemies and trim down their numbers by killing them stealthily., Use melee attacks when cornered: : When an enemy gets to close to you, trying to pull up your weapon and aim will only lead to them getting a hit in first. When an enemy is coming in for you and they get too close, unleashing your melee attacks (default = □ button) is sometimes the best get-off me option.Keep in mind that this is better for weaker enemies like hunters or runners, and will prove much less effective against clickers., Know your enemy!: : Different enemy types will call for different modes of combat, so be sure and know who youre up against. For example, runners can be taken out in a number of ways, and when many present themselves, it is sometimes best to just take them out with whatever weapons you have in you.Clickers, on the other hand, are completely blind, but if they hear you and are able to get in close, they can one-shot you in an instant. For this enemy, youll usually always want to take the sneaky approach, walking lightly to get near them, then taking them out with a stealth kill., Keep an eye on your health!: : Your health is shown next to your ammo, on the bottom right of the screen. Taking hits from runners and other enemies will deplete your health, so youll need to heal up before it runs out. Using a Health Kit will allow you to restore some HPーbut beware that you are vulnerable while healing! Make sure to get to a safe spot to heal before you can hop back into the action., Increasing Your Accuracy: : You can increase the accuracy of your shots by upgrading the stability of your weapon on the workbench. However, if you want to save yourscavenged partsfor other upgrades, you can try crouching or going prone to increase the accuracy of your shots without having to use scavenged parts.Note:You can further increase your aim using theHold Breathskill from the Precision skill branch., Work Smart, Not Hard!: : There are some situations where you will have to fight against infected enemies and human enemies at the same time. You can use this to your advantage by using a glass bottle or a brick to lure the infected near the humans, which will cause them to fight one another, and significantly trim down their numbers without you having to risk your own life., Being Smart with Human Stealth Kills: : Human enemies tend to communicate with each other when they are hunting for you. Try to take them out when they are alone to reduce the chances of you getting found. If you try to kill an enemy while they are talking to someone, they will immediately figure out that you are close by.Also, human enemies will alert other humans to search the area whenever they see a dead body. Be sure to get away from the body quickly after you execute a Stealth Kill!, Making the Most of your Companion: : Performing a Stealth Kill on an enemy with a companion will automatically cause your companion to perform his/her stealth kill to a nearby enemy. This is an extremely effective when trying to eliminate enemies who are working together.Your companion will also join in combat when you are under attack, so sometimes you might want to play it safe and let them do some of the work for you!, New Routes: : You can break glass windows for new routes and better positioning during combat. However, this can give away your location and draw attention to nearby enemies because of the loud breaking sound.",../Data/Images/tips_images/Combat Guide and Tips.jpg
What Are Player Upgrades?,"How to Upgrade Skills: : , Learn via supplements: : Skills can be upgraded through the use of Supplements, which are found in various areas throughout the story. You wont be able to upgrade all skills in a single playthrough of The Last of Us 2, so be sure and think carefully about which skills you want to upgrade.To upgrade skills, first press the touchpad on your control, then press R1 to switch over to skill branches. Select the skill that you want to upgrade, then hold the Learn button (in our case ○) to spend supplements and upgrade it.The following trophies are unlocked by upgrading skills:Note:Survival Expert is only unlockable viaNew Game Plus.Trophy List and Guide, , How to Unlock New Branches: : New Player Upgrade branches are unlocked by using Training Manuals. Find Training Manuals to unlock new upgrade branches!List of Training Manuals and Locations, List of All Player Upgrades: , Survival: , Crafting: , Stealth: , Explosives: , Precision: , Field Tactics: , Covert Ops: , Close Quarters: , Firearms: , Ordinance",../Data/Images/tips_images/What Are Player Upgrades.jpg
What is Listen Mode?,"How to Use Listen Mode: : Listen mode can be used by holding the R1 button. Doing this will automatically force you to crouch, and cause you to walk even slower than the normal crouch walk speed. While holding the R1 button down, the screen will become much darker, and nearby enemies will be indicated by a blurry white outline. Note that while in listen mode, you will be unable to draw your weapon or do anything other than move slowly.After using listen mode to look for foes, your next option is up to you. If you spot an enemy, you will typically want to do one of three things:The precise option you go with depends a little bit on your playstyle, as well as the situation you are in. For the most part, Listen Mode is a great tool for executing stealth kills on enemies, since it will let you track the enemys location before it becomes aware of yours. This option lets you eliminate the threat without alerting other enemies and conserving ammo.How to Stealth Kill | Stealth TipsIn other situations, you may opt to simply sneak past the enemy, especially if you are the type of player who just likes to get through an area as quickly as possible without exploring. Sometimes an enemy will detect you before you can sneak past them or stealth kill them, so Listen Mode will at least let you know to prepare for battle., Listen Mode Upgrades: : By using supplements, you can increase the effectiveness of Listen Mode. The upgrades are as follows:Note: The list of upgrades is still under construction.",../Data/Images/tips_images/What is Listen Mode.jpg
How to Stealth Kill,"Stealth Tips: : For stealth killing to work effecitively, it should come as no surprise that you should avoid having your cover blown. If you stealth kill one enemy right in front of another enemy facing your direction, they will be aware of your presence, which defeats the purpose of using a stealth kill.Here are a few tips to help you make the most of this type of attack., Spot enemies with Listen Mode: : Before going into a room where you suspect enemies are in, hold R1 to enter Listen Mode. This will allow you to detect where each enemy is, and figure out which ones you need to avoid being spotted by.In listen mode, enemies can be spotted as white blurs, which are often moving.How to Use Listen Mode, Sneak up behind enemies while crouched: : Crouching will make you very slow, but also extremely quiet when compared to walking normally. On the other hand, holding L1 and sprinting lets you go fast, but you will be heard by your enemies. When you want to stealth kill your enemies, approach them from behind after pressing the crouch button (○) so that they dont hear you coming up from behind.For some enemies, like runners, simply moving while crouched is enough to catch them by surprise. Clickers have a better sense of heating, so you will have to sneak up on them by lightly holding the stick forward., Hide behind obstacles when approaching: : In addition to crouching, using obstacles such as cars, furniture, or anything else lying around, is a great way to get the upper hand on your foes. Since foes are normally moving, staying close to and looping around these objects can keep you from getting spotted., Target moving enemies first: : When there are multiple enemies in the same vicinity, the order you stealth kill them in is very important. Usually, your enemies will be moving, but some of them (such as when fighting multiple infected) will remain still. Watch their movements, and base the order you will attack in appropriately.As a rule of thumb, save the enemies who seem to not move for last. The moving enemies are the ones you should aim for first, since getting them out of the way will allow you to easily take out the remaining enemies., Look for movement patterns: : When dealing with several enemies that move around, be sure and observe them for a bit before rushing in for the kill. Most moving enemies follow a pattern, so watching them allows you to pick up on this and wait for the best opportunity to strike, or stealth kill another enemy once they are at a distance where they wont spot you., Benefits of Stealth Killing: , Conserve Ammo: : The most obvious benefit to stealth killing is that it allows you to take out an enemy without using up any ammo. Ammo can be scarce (especially on higher difficulties), so rather than using it recklessly, you can save it for when you need it and take care of unalerted enemies without wasting resources.An important point about stealth killing is thatit will not cause you to lose your shiv, unlike the first Last of Us where stealth skills could only be done if you had a shiv made in advance (which had a limited number of uses, and meant that simply running past enemies was often the best option). In TLoU2, you dont need to worry about shivs breaking, so feel free to stealth kill every enemy you can!, Easy Kills: : While sneaking up on an opponent and taking them up certainly requires an element of strategy, it will allow you to avoid combat, where you could potentially take damage or even die. Unless you just prefer to play by shooting down everything in your path (which, given the lack of ammo, is not always possible), sneak kills are the simple way to take out enemies blocking your path.Of course, there are times when Stealth Kills will not be ideal, or even possible. Once an enemy is aware of your presence, stealth killing is no longer an option, and youll have to instead deal with them the old fashioned way (via combat).",../Data/Images/tips_images/How to Stealth Kill.jpg
Workbench Customization,"Find a Workbench: : Youll need to find a workbench before you can upgrade your weapons. After doing so, simply walk up and press △, then select the weapon you want to upgrade, and finally choose the upgrade you want.The first workbench is found in Jackson when patrolling with Dina, after entering the house from the blizzard., , Required Components: : In order to upgrade your weapons you will need the weapon (of course) and Scrap that can be picked up from around the game world. These can be found all over, so be sure and pick them up as you see them.What are Scavenged Parts?, Choose your upgrades carefully!: : There wont be enough scavenged parts to get all of the weapon upgrades in one playthrough, so think carefully about the upgrades you will get. Certain trophies can be unlocked after obtaining enough upgrades.Note:Arms Master is only unlockable viaNew Game Plus.Trophy List and Guide, , List of Weapon Upgrades: , Semi-Auto Pistol: : Semi-Auto Pistol: Location and Best Upgrades, , Bolt-Action Rifle: : Bolt-Action Rifle: Location and Best Upgrades, , Revolver: : Revolver: Location and Best Upgrades, , Pump Shotgun: : Pump Shotgun: Location and Best Upgrades, , Bow: : Bow: Location and Best Upgrades, , Military Pistol: : Military Pistol: Location and Best Upgrades, , Semi-Auto Rifle: : Semi-Auto Rifle: Location and Best Upgrades, , Hunting Pistol: : Hunting Pistol: Location and Best Upgrades, , Double Barrel Shotgun: : Double Barrel Shotgun: Location and Best Upgrades, , Crossbow: : Crossbow: Location and Best Upgrades",../Data/Images/tips_images/Workbench Customization.jpg
How to the Ride Horse,"Mounting: : You can Mount or Dismount your horse by pressing the Triangle button (△) on your controller., Controlling the Horse: : You can control the movement of your horse by moving the left analog stick on your controller and the camera movement with your right analog stick. Also, your horse can Gallop by pressing and holding the L1 button while controlling your horse to make it move faster., Jumping While on a Horse: : Some areas in the game requires you to jump over an obstacle while riding a horse. You can press the X button in front of an obstacle to jump over it, and your horse will automatically jump over obstacles in the way when galloping., Horseback Combat: : While riding your horse,you will be unable to draw your weapon or attack in any way(enemies do not tend to show up in horse sections). If you were hoping for a bit of gun shooting while riding around, you will be sorely disappointed.",../Data/Images/tips_images/How to the Ride Horse.jpg
How to Heal,"Crafting a Health Kit: : Pressing the Touchpad on your controller will let you access the crafting menu, where you can choose to craft a Health Kit. You can also access this menu by pressing the craft button after selecting the Health Kit using your D-Pad.The following ingredients are needed to craft a Health Kit.",../Data/Images/tips_images/How to Heal.jpg
How to Use Quick Turn,"Quick Turn to Retreat: : Quick Turn can help you perform faster escapes if you ever get spotted by hunters or the infected. This way, you can create some distance from the enemy and prepare for the situation. Knowing how to use this trick beforehand is important, so be sure and practice a bit before trying to implement it., Tracking Enemies: : You can use Quick Turn in different situations where you have to quickly turn your camera around instead of panning slowly, which takes more time. Quick Turns are especially useful in situations where you are fighting multiple enemies from different angles and you need to keep track of their positions.",../Data/Images/tips_images/How to Use Quick Turn.jpg
How to Run (Sprint),"When to Avoid Sprinting: : Sprinting while an enemy is close by gives away your position, making you an easy target. Avoid sprinting in tight areas where enemies might be lurking around. It is recommended that you only use sprint in areas that you have already cleared, or ones that you have scouted out first withListen Mode.",../Data/Images/tips_images/How to Run (Sprint).jpg
How to Turn on Aim Assist,"Lock-On Aim: : Turning on the Lock-On Aim will automatically lock-on your crosshair to the enemys body when aiming. You can also press the R3 button to target the head or the legs of an enemy.This can also be changed at theAssistancesection from the Controls Menu inside the Options., Auto-Target: : Selecting Auto-Target will automatically lock your aim onto the next enemy, even if they are offscreen.",../Data/Images/tips_images/How to Turn on Aim Assist.jpg
How to Ride the Boat,"Boat Controls: : You can ride the boat by pressing △ (default) at the motor, which can be found at the rear of the boat. It will prompt a mini-game like sequence, similar to thegenerator, where you will have to perfectly time your button press until it fills up the bar.Once you are riding the boat, it can be steered using the left analog stick, and moved in reverse by pressing the L2 trigger. Keep in mind that the motor of the boat isextremely loud and can attract the attention of the nearby enemies., Ramps and Barbed Wires: : When using the speedboat you can go over barbed wires and ramps to explore areas that you wouldnt normally be able to while swimming. Also, ramps work a bit differently from the barbed wires.Once you go over a ramp, you will not be able to come back. Be sure to explore the area thoroughly before going over a ramp!, Locating the Boat: : If you leave the boat behind to explore other areas, you can useListen Modeto pinpoint its exact location, making it easier to backtrack and return into progressing the story.",../Data/Images/tips_images/How to Ride the Boat.jpg
What are Scavenged Parts?,"Customizing Weapons with Scavenged Parts: , Upgrading with the Workbench: : The only way to customize your weapon is by going to aWorkbench. You may encounter these Workbenches throughout the game, or if you are in a safe zone.For more information on Customizing your Weapons, see the link below:How to Customize Weapons, How to Get Scavenged Parts: : Scavenged Parts can be found anywhere in the game. Be sure to explore and check every corner of all the areas if possible. They are most commonly seen on top of shelves or on table with nearby tools.If you turn onHigh Contrast Modefrom the accesibility settings (or by swiping left on the touchpad), you will be able to easily spot anything in the area that can be interacted with, allowing you to easily find and pick up any parts that are lying around., Enhanced Listen Mode: : If you are having a hard time locating the scavenged parts in the area, you can turn onEnhanced Listen Modein the Options menu. This will allow you to scan and pinpoint the exact location of nearby items and even enemies.",../Data/Images/tips_images/What are Scavenged Parts.jpg
What are Ingredients?,"How to Use Ingredients: , List of Ingredients: : The following items are the different ingredients that you can pick up throughout the game:, , Crafting Items: : You can use these Ingredients through Crafting. You access the Crafting menu by pressing on the Touchpad, which will display a list of the different recipes that you can Craft with the ingredients you have.Recipe List, , How to Get Ingredients: : Ingredients can be found anywhere in the game. Be sure to explore and check every corner of all the areas if possible, especially on places where there are drawers or cabinets that you can open.If you turn onHigh Contrast Modefrom the accesibility settings (or by swiping left on the touchpad), you will be able to easily spot anything in the area that can be interacted with, allowing you to easily find and pick up any ingredients that are lying around., Enhanced Listen Mode: : If you are having a hard time locating the ingredients in the area, you can turn onEnhanced Listen Modein the Options menu. This will allow you to scan and pinpoint the exact location of nearby items and even enemies., Related Links: : Tips & Tricks",../Data/Images/tips_images/What are Ingredients.jpg
What Are Training Manuals?,"About Training Manual Locations: : There are several locations that you can pick up training manuals. Even if you miss one of the locations listed below for the manual on this page, you can still find the manual in a different location, so there is no need to restart your save. For example, if you miss the first magazine in the overturned truck, you can find the Crafting Training Manual at the Court House on the 2nd floor.Therefore,this guide will show the first obtainable location for each manual. If you miss a location, it will show up in a different spot on its own, so you dont need to worry much about trying to find them., Crafting Training Manual: : Crafting Skill Branch, , Crafting: : , , Stealth Training Manual: : Stealth Skill Branch, , Stealth: : , , Precision Training Manual: : Precision Skill Branch, , Precision: : , , Explosive Training Manual: : Explosive Skill Branch, , Explosives: : , , Covert Ops Training Manual: : Covert Ops Skill Branch, , Covert Ops: : , , Close Quarters Training Manual: : Close Quarters Skill Branch, , Close Quarters: : , , Firearms Training Manual: : Explosive Skill Branch, , Firearms: : , , Ordnance Traning Manual: : Ordnance Skill Branch, , Ordnance: : , , Last of Us 2 Collectibles: : List of Collectibles and Locations",../Data/Images/tips_images/What Are Training Manuals.jpg
What are Recipes?,"How to Craft: : Recipes can be accessed by pressing theTouchpadand opening up the crafting menu. Here you can see a list of all the tools and weapons that you can craft with the ingredients you have with you., Unlocking Recipes: : To unlock a recipe, you must first pick up the tool or weapon for the first time to learn its components. Once you have them in your inventory, you will be able to craft them as long as you have the correct materials. For the most part, you will learn these automatically as you progress, although a few are unlocked via other methods (such asPlayer Upgrades, etc.)Unlocking all recipes and crafting all items is required to get the following trophy.Trophy Guide | List of Trophies, , Managing Your Resources: : Whenever you reach the maximum capacity of a material, you wont be able to pick them up when you find more on the ground. Be sure to check if you can craft any tool or weapon from the crafting menu that uses said ingredient, use it, and pick up the one you found. This is a simple trick to manage your resources and maximize the tools you get to survive., List of Recipes: : The following items are the different recipes that you can craft with the materials that you find throughout the game.",../Data/Images/tips_images/What are Recipes.jpg
What is a Workbench?,"List of Workbench Locations: , Jackson Workbenches: , Seattle Day 1 (Ellie) Workbenches: , Seattle Day 2 (Ellie) Workbenches: , Seattle Day 3 (Ellie) Workbenches: , Seattle Day 1 (Abby) Workbenches: , Seattle Day 2 (Abby) Workbenches: , Seattle Day 3 (Abby) Workbenches: , Santa Barbara Workbenches: , Related Links: : Tips & Tricks",../Data/Images/tips_images/What is a Workbench.jpg
How to Get Infinite Ammo,"Custom Difficulty Settings: : Custom Difficulty settings allow you to pick and choose which parts of the game will be hard or easy. If you want to have an easier time coming across more ammo and resources, go into game difficulty, and changeResourcestoVery Light. Even if you still want the enemies and game to be challenging, simply changing this one feature will make it easier to pick up ammo.Difficulty Settings and Best Difficulty, Execute Stealth Kills: : If you are still hidden during combat, it is suggested that you execute stealth kills as much as possible instead of wasting your ammo for kills. Only use your ammo when trying to execute enemies that you cannot reach or when they have already found your position.If you have an ally with you, they will often also execute a stealth kill when you do, allowing you to conserve even more ammo by making use of your partner., Sweeping the Area: : Be sure to explore every corner of the area before moving on in the campaign. This will not only allow you to get more ammo and ingredients, but also collect all hidden items in the area., Using Enhanced Listen Mode: : Pressing the Circle button while using Enhanced Listen Mode will allow you to pinpoint the exact location of any nearby items like ingredients and ammo.Using Enhanced Listen Mode, Reduced Weapon Sway: : Turning this feature on will cause your weapon to sway less when aiming, allowing you to land your shots more accurately and be more efficient with your ammo consumption.Game Controls & Settings, Enabling Auto Pick-Up: : You can also enable this in the Accessibility Menu inside Alternate Controls. This will allow you to automatically pick up any nearby items such as ingredients and ammo when you approach them.Accessibility Presets, Last of Us 2 Related Links: : Tips & Tricks",../Data/Images/tips_images/How to Get Infinite Ammo.jpg
How to Find the Downtown Seattle Map,Bypassing Locked Doors: : You can easily bypass some of the lock doors that you will find throughout the game by breaking the nearby window using the butt of your knife. This way you can easily squeeze your way in and unlock the door from the other side.,../Data/Images/tips_images/How to Find the Downtown Seattle Map.jpg
